{
  "projectAcronym": "EVOLVE2CARE",
  "projectStartDate": "2024-10-01",
  "totalMonths": 24,
  "categories": [
    {
      "name": "EXPECTED OUTCOME #1",
      "groups": [
        {
          "kpis": [
            {
              "label": "Reports on experimentation findings including regulatory barriers",
              "target": "10",
              "unit": "count",
              "code": "[EO#1]",
              "achieved": 0,
              "monthlyValues": [
                null,
                null,
                null,
                null,
                null,
                null,
                null,
                null,
                null,
                null,
                null,
                null,
                null,
                null,
                null,
                null,
                null,
                null,
                null,
                null,
                null,
                null,
                null,
                null
              ]
            },
            {
              "label": "Innovators benefited from experimentation services",
              "target": "10",
              "unit": "count",
              "code": "[EO#1]",
              "achieved": 0,
              "monthlyValues": [
                null,
                null,
                null,
                null,
                null,
                null,
                null,
                null,
                null,
                null,
                null,
                null,
                null,
                null,
                null,
                null,
                null,
                null,
                null,
                null,
                null,
                null,
                null,
                null
              ]
            },
            {
              "label": "Tailored Training Programs (1 for Living Labs and 1 for Innovators)",
              "target": "2",
              "unit": "count",
              "code": "[EO#1]",
              "achieved": 0,
              "monthlyValues": [
                null,
                null,
                null,
                null,
                null,
                null,
                null,
                null,
                null,
                null,
                null,
                null,
                null,
                null,
                null,
                null,
                null,
                null,
                null,
                null,
                null,
                null,
                null,
                null
              ]
            },
            {
              "label": "Living Labs participating in trainings",
              "target": "20",
              "unit": "count",
              "code": "[EO#1]",
              "achieved": 0,
              "monthlyValues": [
                null,
                null,
                null,
                null,
                null,
                null,
                null,
                null,
                null,
                null,
                null,
                null,
                null,
                null,
                null,
                null,
                null,
                null,
                null,
                null,
                null,
                null,
                null,
                null
              ]
            },
            {
              "label": "Living Labs engaged in user centric knowledge and experimentation activities",
              "target": "40",
              "unit": "count",
              "code": "[EO#1]",
              "achieved": 0,
              "monthlyValues": [
                null,
                null,
                null,
                null,
                null,
                null,
                null,
                null,
                null,
                null,
                null,
                null,
                null,
                null,
                null,
                null,
                null,
                null,
                null,
                null,
                null,
                null,
                null,
                null
              ]
            },
            {
              "label": "Services for testing innovations",
              "target": "10",
              "unit": "count",
              "code": "[EO#1]",
              "achieved": 0,
              "monthlyValues": [
                null,
                null,
                null,
                null,
                null,
                null,
                null,
                null,
                null,
                null,
                null,
                null,
                null,
                null,
                null,
                null,
                null,
                null,
                null,
                null,
                null,
                null,
                null,
                null
              ]
            },
            {
              "label": "Action Plans",
              "target": "1",
              "unit": "count",
              "code": "[EO#1]",
              "achieved": 0,
              "monthlyValues": [
                null,
                null,
                null,
                null,
                null,
                null,
                null,
                null,
                null,
                null,
                null,
                null,
                null,
                null,
                null,
                null,
                null,
                null,
                null,
                null,
                null,
                null,
                null,
                null
              ]
            }
          ]
        }
      ]
    },
    {
      "name": "EXPECTED OUTCOME #2",
      "groups": [
        {
          "kpis": [
            {
              "label": "Innovators submit application",
              "target": "30",
              "unit": "count",
              "code": "[EO#2]",
              "achieved": 0,
              "monthlyValues": [
                null,
                null,
                null,
                null,
                null,
                null,
                null,
                null,
                null,
                null,
                null,
                null,
                null,
                null,
                null,
                null,
                null,
                null,
                null,
                null,
                null,
                null,
                null,
                null
              ]
            },
            {
              "label": "Innovators show intention by opening applications on the platform",
              "target": "50",
              "unit": "count",
              "code": "[EO#2]",
              "achieved": 0,
              "monthlyValues": [
                null,
                null,
                null,
                null,
                null,
                null,
                null,
                null,
                null,
                null,
                null,
                null,
                null,
                null,
                null,
                null,
                null,
                null,
                null,
                null,
                null,
                null,
                null,
                null
              ]
            },
            {
              "label": "Innovators selected",
              "target": "10",
              "unit": "count",
              "code": "[EO#2]",
              "achieved": 0,
              "monthlyValues": [
                null,
                null,
                null,
                null,
                null,
                null,
                null,
                null,
                null,
                null,
                null,
                null,
                null,
                null,
                null,
                null,
                null,
                null,
                null,
                null,
                null,
                null,
                null,
                null
              ]
            },
            {
              "label": "Services provided",
              "target": "10",
              "unit": "count",
              "code": "[EO#2]",
              "achieved": 0,
              "monthlyValues": [
                null,
                null,
                null,
                null,
                null,
                null,
                null,
                null,
                null,
                null,
                null,
                null,
                null,
                null,
                null,
                null,
                null,
                null,
                null,
                null,
                null,
                null,
                null,
                null
              ]
            },
            {
              "label": "Time to market reduction",
              "target": "-3 months",
              "code": "[EO#2]",
              "achieved": 0,
              "monthlyValues": [
                null,
                null,
                null,
                null,
                null,
                null,
                null,
                null,
                null,
                null,
                null,
                null,
                null,
                null,
                null,
                null,
                null,
                null,
                null,
                null,
                null,
                null,
                null,
                null
              ]
            },
            {
              "label": "Development costs reduction",
              "target": "5%",
              "code": "[EO#2]",